{
  "schemaVersion": "1.0",
  "eventId": "018f47a2-f5ce-7a4b-8f54-80e5d3eaf092",
  "observedAt": "2026-10-08T10:20:00.000Z",
  "traceId": "9f3a2c1e4b5d67890123456789abcdef",
  "identity": {
    "subject": {
      "id": "user:alice@example.com",
      "type": "human",
      "displayName": "Alice",
      "organizationId": "acme",
      "authenticationMethod": "oidc",
      "assurance": "authenticated"
    },
    "actor": {
      "id": "workload:deployment-api",
      "type": "workload",
      "displayName": "Deployment API",
      "organizationId": "acme",
      "authenticationMethod": "mtls",
      "assurance": "authenticated"
    },
    "evidence": [
      {
        "evidenceId": "evidence-oidc-alice",
        "subjectId": "user:alice@example.com",
        "kind": "oidc_token",
        "assurance": "authenticated",
        "issuer": "https://id.acme.example",
        "verifiedAt": "2026-10-08T10:19:59.000Z",
        "credentialFingerprint": "sha256:bbbbbbbbbbbbbbbbbbbbbbbbbbbbbbbbbbbbbbbbbbbbbbbbbbbbbbbbbbbbbbbb"
      },
      {
        "evidenceId": "evidence-mtls-deployment-api",
        "subjectId": "workload:deployment-api",
        "kind": "mtls_certificate",
        "assurance": "authenticated",
        "issuer": "acme-workload-ca",
        "verifiedAt": "2026-10-08T10:19:59.000Z",
        "credentialFingerprint": "sha256:cccccccccccccccccccccccccccccccccccccccccccccccccccccccccccccccc"
      }
    ]
  },
  "trigger": {
    "kind": "service",
    "origin": "api",
    "requestId": "req-api-2001",
    "clientName": "deployment-api",
    "clientVersion": "1.4.0"
  },
  "declaredIntent": {
    "goal": "Allow HTTPS from the corporate ingress range",
    "source": "api_field"
  },
  "action": {
    "protocol": "sdk",
    "toolName": "aws.ec2.update_security_group",
    "arguments": {
      "groupId": "sg-demo",
      "port": 443,
      "cidr": "192.0.2.0/24"
    },
    "target": {
      "system": "aws",
      "environment": "prod",
      "accountId": "simulated-123",
      "resourceType": "security-group"
    }
  },
  "lineage": {
    "rootPrincipalId": "user:alice@example.com",
    "hops": [
      {
        "hopId": "hop-api-user",
        "kind": "principal",
        "subjectId": "user:alice@example.com",
        "assurance": "authenticated",
        "source": "acme-oidc",
        "observedAt": "2026-10-08T10:19:59.000Z"
      },
      {
        "hopId": "hop-deployment-api",
        "parentHopId": "hop-api-user",
        "kind": "agent",
        "subjectId": "workload:deployment-api",
        "assurance": "delegated",
        "source": "tracepermit-delegation",
        "observedAt": "2026-10-08T10:20:00.000Z",
        "delegationTokenId": "delegation-api-001"
      }
    ],
    "delegations": [
      {
        "tokenId": "delegation-api-001",
        "issuer": "tracepermit",
        "subjectId": "workload:deployment-api",
        "actorId": "user:alice@example.com",
        "audience": "tracepermit-gateway",
        "scopes": ["aws.ec2.security_group.update"],
        "resources": ["aws:simulated-123:security-group:sg-demo"],
        "purpose": "approved deployment change",
        "traceId": "9f3a2c1e4b5d67890123456789abcdef",
        "issuedAt": "2026-10-08T10:19:50.000Z",
        "expiresAt": "2026-10-08T10:24:50.000Z",
        "tokenHash": "sha256:dddddddddddddddddddddddddddddddddddddddddddddddddddddddddddddddd",
        "verification": "verified"
      }
    ]
  },
  "clientClaims": {
    "changeTicket": "CHG-1001"
  }
}
