{
  "schemaVersion": "1.0",
  "eventId": "018f47a2-f5ce-7a4b-8f54-80e5d3eaf116",
  "observedAt": "2026-10-16T12:00:00.000Z",
  "traceId": "10010010010010010010010010010016",
  "identity": {
    "subject": {
      "id": "workload:metrics-collector",
      "type": "workload",
      "displayName": "Metrics Collector",
      "organizationId": "acme",
      "authenticationMethod": "mtls",
      "assurance": "authenticated"
    },
    "actor": {
      "id": "workload:metrics-collector",
      "type": "workload",
      "displayName": "Metrics Collector",
      "organizationId": "acme",
      "authenticationMethod": "mtls",
      "assurance": "authenticated"
    },
    "evidence": [
      {
        "evidenceId": "evidence-mtls-collector",
        "subjectId": "workload:metrics-collector",
        "kind": "mtls_certificate",
        "assurance": "authenticated",
        "issuer": "acme-ca",
        "verifiedAt": "2026-10-16T11:59:59.000Z",
        "credentialFingerprint": "sha256:1001001001001001001001001001001001001001001001001001001001001001"
      }
    ]
  },
  "trigger": {
    "kind": "service",
    "origin": "cli",
    "requestId": "req-template-hardening-16",
    "clientName": "MetricsCollector"
  },
  "declaredIntent": {
    "goal": "Synthetic qualification: CLI workload write isolates subject type",
    "source": "api_field"
  },
  "action": {
    "protocol": "cli",
    "toolName": "aws.ec2.update_security_group",
    "arguments": {
      "groupId": "sg-staging-001",
      "port": 443,
      "cidr": "10.0.0.0/16"
    },
    "target": {
      "system": "aws",
      "environment": "staging",
      "accountId": "simulated-123",
      "resourceType": "security-group"
    }
  },
  "lineage": {
    "rootPrincipalId": "workload:metrics-collector",
    "hops": [
      {
        "hopId": "hop-collector",
        "kind": "principal",
        "subjectId": "workload:metrics-collector",
        "assurance": "authenticated",
        "source": "acme-mtls",
        "observedAt": "2026-10-16T11:59:59.000Z"
      }
    ],
    "delegations": []
  },
  "clientClaims": {
    "profile": "workload-collector"
  }
}
